{
  "$schema": "https://json-schema.org/draft/2020-12/schema",
  "$id": "https://ai-companion.local/schemas/observability-snapshot.v1.schema.json",
  "title": "Observability snapshot v1",
  "type": "object",
  "additionalProperties": false,
  "required": ["schema_version", "generated_at", "source", "metrics"],
  "properties": {
    "schema_version": {"const": "observability-snapshot-v1"},
    "generated_at": {"type": "string", "format": "date-time"},
    "source": {
      "type": "object",
      "additionalProperties": false,
      "required": ["input_kind", "sha256"],
      "properties": {
        "input_kind": {"const": "prometheus_text"},
        "sha256": {"type": "string", "pattern": "^[0-9a-f]{64}$"}
      }
    },
    "metrics": {"$ref": "#/$defs/metrics"}
  },
  "$defs": {
    "metrics": {
      "type": "object",
      "additionalProperties": false,
      "required": [
        "degradation_level",
        "queue_lag",
        "oldest_job_age_seconds",
        "model_error_ratio",
        "model_latency_p95_seconds",
        "agent_run_duration_p95_seconds",
        "agent_runs_completed",
        "agent_runs_failed",
        "agent_runs_timed_out",
        "retry_scheduled",
        "retry_recovered",
        "retry_exhausted",
        "retry_deadline_exhausted",
        "retry_recovery_ratio",
        "agent_terminal_failures",
        "retry_exhausted_total",
        "retry_settled"
      ],
      "properties": {
        "degradation_level": {"type": "number", "minimum": 0},
        "queue_lag": {"type": "number", "minimum": 0},
        "oldest_job_age_seconds": {"type": "number", "minimum": 0},
        "model_error_ratio": {"type": "number", "minimum": 0, "maximum": 1},
        "model_latency_p95_seconds": {"type": "number", "minimum": 0},
        "agent_run_duration_p95_seconds": {"type": "number", "minimum": 0},
        "agent_runs_completed": {"type": "number", "minimum": 0},
        "agent_runs_failed": {"type": "number", "minimum": 0},
        "agent_runs_timed_out": {"type": "number", "minimum": 0},
        "retry_scheduled": {"type": "number", "minimum": 0},
        "retry_recovered": {"type": "number", "minimum": 0},
        "retry_exhausted": {"type": "number", "minimum": 0},
        "retry_deadline_exhausted": {"type": "number", "minimum": 0},
        "retry_recovery_ratio": {"type": "number", "minimum": 0, "maximum": 1},
        "agent_terminal_failures": {"type": "number", "minimum": 0},
        "retry_exhausted_total": {"type": "number", "minimum": 0},
        "retry_settled": {"type": "number", "minimum": 0}
      }
    }
  }
}
